{
  "softwareType": "web_application",
  "platforms": ["web_browser"],
  "deploymentModel": "saas",
  "userFacingRequirements": {
    "performance": {
      "responseTime": {
        "target": "< 1 second for UI interactions",
        "maximum": "< 3 seconds for AI content generation",
        "percentile": "95th percentile"
      },
      "throughput": {
        "target": "1000 concurrent users",
        "peak": "5000 concurrent users during campaign launches"
      },
      "loadTime": {
        "initial": "< 2 seconds for app shell",
        "subsequent": "< 500ms for page navigation"
      },
      "concurrentUsers": "1000 users creating campaigns simultaneously"
    },
    "availability": {
      "uptime": "99.9% (8.77 hours downtime per year)",
      "maintenanceWindows": "Sunday 2-4 AM EST monthly",
      "recoveryTime": "< 15 minutes for critical failures",
      "backupFrequency": "Real-time database replication with hourly snapshots"
    },
    "usability": {
      "learnability": "Small business owners can create first campaign in under 30 minutes",
      "efficiency": "Experienced users can launch campaigns in under 10 minutes",
      "memorability": "Users return after 30 days and complete tasks without re-learning",
      "errorRecovery": "Clear error messages with suggested fixes and undo capabilities",
      "satisfaction": "Target NPS score of 50+ and 4.5+ app store rating"
    },
    "accessibility": {
      "wcagLevel": "AA",
      "screenReader": true,
      "keyboardNavigation": true,
      "colorContrast": "4.5:1 minimum ratio for normal text, 3:1 for large text",
      "fontSizing": true,
      "languages": ["en-US", "es-ES", "fr-FR", "de-DE"],
      "rightToLeft": false
    },
    "security": {
      "authentication": ["password", "sso", "oauth"],
      "authorization": "Role-based access control (RBAC) with team permissions",
      "dataEncryption": "AES-256 encryption at rest, TLS 1.3 in transit",
      "sessionSecurity": "JWT tokens with 8-hour expiry and refresh token rotation",
      "auditLogging": true,
      "complianceStandards": ["SOC 2 Type II", "GDPR", "CCPA"]
    },
    "compatibility": {
      "browserSupport": ["Chrome 100+", "Firefox 100+", "Safari 15+", "Edge 100+"],
      "deviceSupport": ["Desktop", "Tablet (landscape)", "Mobile (responsive)"],
      "osVersions": ["Windows 10+", "macOS 11+", "iOS 15+", "Android 10+"],
      "backwardCompatibility": "Support previous 2 major browser versions",
      "integrations": [
        "Facebook/Meta Business API",
        "Instagram Business API", 
        "LinkedIn Marketing API",
        "Google Ads API",
        "Twitter API v2",
        "Mailchimp API",
        "Salesforce Marketing Cloud",
        "HubSpot API",
        "Zapier Platform",
        "Stripe Billing API"
      ]
    },
    "scalability": {
      "userGrowth": "Support 10x user growth (10,000 to 100,000 users) without architecture changes",
      "dataGrowth": "Handle 1TB+ of campaign assets and analytics data per year",
      "horizontalScaling": true,
      "verticalScaling": true,
      "autoScaling": true
    },
    "reliability": {
      "errorRate": "< 0.1% for critical user actions",
      "faultTolerance": "Graceful degradation when AI services are unavailable",
      "gracefulDegradation": "Basic campaign creation available even when AI features are down",
      "dataIntegrity": "ACID compliance for campaign data, eventual consistency for analytics"
    }
  },
  "technicalConstraints": {
    "budgetConstraints": "Bootstrap budget - optimize for cost efficiency in year 1",
    "timeConstraints": "MVP in 6 months, full feature set in 12 months",
    "teamSkills": ["React/TypeScript", "Node.js", "Python", "AWS", "Machine Learning", "UX Design"],
    "existingInfrastructure": "AWS cloud-first, microservices architecture, PostgreSQL primary database",
    "regulatoryRequirements": ["GDPR compliance for EU users", "CCPA compliance for California users", "Content moderation for AI-generated text"],
    "vendorRestrictions": ["Must support multiple AI providers (OpenAI, Anthropic, Cohere)", "No vendor lock-in for critical services"]
  },
  "userInteractionModel": {
    "inputMethods": ["keyboard", "mouse", "touch"],
    "outputMethods": ["visual", "email", "notifications"],
    "interactionPatterns": ["gui"],
    "sessionModel": "stateful",
    "offlineCapability": false,
    "realTimeFeatures": true
  },
  "dataRequirements": {
    "dataTypes": ["structured", "unstructured", "media"],
    "dataVolume": "100GB campaign assets, 10GB user data, 1TB analytics per year",
    "dataRetention": "Campaign data: 7 years, Analytics: 3 years, User activity: 2 years",
    "dataPrivacy": "GDPR/CCPA compliant data handling, user data export/deletion on request",
    "dataLocation": "Primary: US East (AWS us-east-1), EU: EU West (AWS eu-west-1) for GDPR compliance",
    "backupStrategy": "Automated daily backups with 30-day retention, quarterly archives for compliance"
  },
  "integrationRequirements": [
    {
      "systemName": "OpenAI GPT API",
      "integrationType": "api",
      "dataFlow": "bidirectional",
      "frequency": "real_time",
      "criticality": "critical",
      "authentication": "API key with rate limiting"
    },
    {
      "systemName": "Facebook Marketing API",
      "integrationType": "api", 
      "dataFlow": "bidirectional",
      "frequency": "real_time",
      "criticality": "important",
      "authentication": "OAuth 2.0 with app review"
    },
    {
      "systemName": "Instagram Basic Display API",
      "integrationType": "api",
      "dataFlow": "outbound",
      "frequency": "on_demand",
      "criticality": "important",
      "authentication": "OAuth 2.0"
    },
    {
      "systemName": "Google Ads API",
      "integrationType": "api",
      "dataFlow": "bidirectional", 
      "frequency": "real_time",
      "criticality": "important",
      "authentication": "OAuth 2.0 with developer token"
    },
    {
      "systemName": "Stripe Billing",
      "integrationType": "api",
      "dataFlow": "bidirectional",
      "frequency": "real_time",
      "criticality": "critical",
      "authentication": "API keys with webhooks"
    },
    {
      "systemName": "SendGrid Email API",
      "integrationType": "api",
      "dataFlow": "outbound",
      "frequency": "batch",
      "criticality": "important",
      "authentication": "API key"
    },
    {
      "systemName": "AWS S3",
      "integrationType": "api",
      "dataFlow": "bidirectional",
      "frequency": "real_time",
      "criticality": "critical",
      "authentication": "IAM roles and policies"
    },
    {
      "systemName": "Mixpanel Analytics",
      "integrationType": "api",
      "dataFlow": "outbound",
      "frequency": "real_time",
      "criticality": "nice_to_have",
      "authentication": "API key"
    },
    {
      "systemName": "Intercom Customer Support",
      "integrationType": "webhook",
      "dataFlow": "bidirectional",
      "frequency": "real_time",
      "criticality": "nice_to_have",
      "authentication": "OAuth 2.0"
    }
  ]
}